{
  "$schema": "https://json-schema.org/draft/2020-12/schema",
  "$id": "https://coderit.it/piattaforma-corsi/knowledge_goals_graph.schema.json",
  "title": "Knowledge goals graph (DESIGN SSOT store)",
  "description": "Schema for design/knowledge_goals_graph.json, written solely by learning-curriculum-architect. Encodes the Baseline/Prerequisite/DesiredResult nodes and Requires edges described in .claude/agents/learning-curriculum-architect.md. `personas` is just the list of persona ids used elsewhere in this file (as audience/skippable_by/held_by/etc.) — persona definitions (name, cohort_count, ...) live in the STUDENT_PERSONAS SSOT (specifications/student_personas.md, currently markdown), so there is nothing to $ref here. Node/edge arrays must be sorted by id for stable, git-diffable output. Canvas/layout positions are never stored here.",
  "type": "object",
  "additionalProperties": false,
  "required": ["course_name", "personas", "nodes", "edges"],
  "properties": {
    "course_name": {
      "type": "string",
      "description": "The course this graph belongs to."
    },
    "personas": {
      "type": "array",
      "description": "List of persona ids referenced elsewhere in this graph (audience/skippable_by/held_by/persona_variant). Ids must match STUDENT_PERSONAS (specifications/student_personas.md); definitions (name, cohort_count, ...) are not duplicated here.",
      "items": { "$ref": "#/$defs/persona_ref" },
      "minItems": 1
    },
    "nodes": {
      "type": "array",
      "description": "Baseline, Prerequisite, and DesiredResult nodes, sorted by id.",
      "items": { "$ref": "#/$defs/node" }
    },
    "edges": {
      "type": "array",
      "description": "Requires edges: <from> Requires <to> means <to> must be understood before tackling <from>. Sorted by (from, to).",
      "items": { "$ref": "#/$defs/edge" }
    }
  },
  "$defs": {
    "provenance_tag": {
      "type": "string",
      "enum": ["stated", "inferred", "inherited_inferred", "invented_framing", "risk"]
    },
    "knowledge_type": {
      "type": "string",
      "enum": ["declarative", "procedural", "contextual"]
    },
    "persona_ref": {
      "type": "string",
      "pattern": "^P-[A-Z0-9]+$"
    },
    "audience": {
      "description": "Personas this node is for. \"all\" is the default; narrow to a list when a persona must not be required to hold the node.",
      "oneOf": [
        { "const": "all" },
        {
          "type": "array",
          "items": { "$ref": "#/$defs/persona_ref" },
          "minItems": 1
        }
      ]
    },
    "depth_staging": {
      "type": "object",
      "description": "Present only when this node is one pass among repeated visits to the same topic (spiralling/depth staging).",
      "additionalProperties": false,
      "required": ["pass", "depth"],
      "properties": {
        "pass": {
          "type": "integer",
          "minimum": 1,
          "description": "1-based pass number over this topic."
        },
        "depth": {
          "type": "string",
          "enum": ["shallow", "deep"]
        },
        "note": {
          "type": "string",
          "description": "What changes in this pass relative to the others."
        }
      }
    },
    "node": {
      "type": "object",
      "required": ["id", "type", "provenance_tags", "key", "description", "knowledge_type"],
      "allOf": [
        {
          "if": { "properties": { "type": { "const": "DesiredResult" } } },
          "then": {
            "required": ["audience"],
            "properties": {
              "id": { "pattern": "^DR-[A-Z0-9-]+$" }
            }
          }
        },
        {
          "if": { "properties": { "type": { "const": "Baseline" } } },
          "then": {
            "required": ["held_by"],
            "properties": {
              "id": { "pattern": "^BSL-[A-Z0-9-]+$" }
            }
          }
        },
        {
          "if": { "properties": { "type": { "const": "Prerequisite" } } },
          "then": {
            "required": ["audience"],
            "properties": {
              "id": { "pattern": "^PRQ-[A-Z0-9-]+$" }
            }
          }
        }
      ],
      "properties": {
        "id": {
          "type": "string",
          "description": "<TYPE>-<MNEMONIC>, mnemonic derived from `key`, never a sequence number. Unique."
        },
        "type": {
          "type": "string",
          "enum": ["Baseline", "Prerequisite", "DesiredResult"]
        },
        "provenance_tags": {
          "type": "array",
          "items": { "$ref": "#/$defs/provenance_tag" },
          "minItems": 1
        },
        "key": {
          "type": "string",
          "description": "Representative unique short mnemonic key, e.g. deploy-route."
        },
        "description": {
          "type": "string",
          "description": "Human-readable description, detailed enough for a later role to build an assessment from it."
        },
        "knowledge_type": { "$ref": "#/$defs/knowledge_type" },
        "audience": { "$ref": "#/$defs/audience" },
        "skippable_by": {
          "type": "array",
          "description": "Persona ids in the audience who already hold this node and may skip it. Empty/omitted is normal.",
          "items": { "$ref": "#/$defs/persona_ref" }
        },
        "persona_variant": {
          "type": "array",
          "description": "Optional, only where the same node is genuinely reached differently by different personas. One entry per persona that differs.",
          "items": {
            "type": "object",
            "additionalProperties": false,
            "required": ["persona", "variant"],
            "properties": {
              "persona": { "$ref": "#/$defs/persona_ref" },
              "variant": { "type": "string" }
            }
          }
        },
        "held_by": {
          "type": "array",
          "description": "Baseline only: persona ids that already hold this knowledge. A baseline held by only some personas is the normal case.",
          "items": { "$ref": "#/$defs/persona_ref" }
        },
        "root": {
          "type": "boolean",
          "description": "Prerequisite only: true for a deliberate root (no incoming edge, on purpose)."
        },
        "root_rationale": {
          "type": "string",
          "description": "Required alongside root: true — one-line rationale for why this Prerequisite has no incoming edge."
        },
        "depth_staging": { "$ref": "#/$defs/depth_staging" }
      },
      "additionalProperties": false,
      "if": {
        "properties": { "root": { "const": true } },
        "required": ["root"]
      },
      "then": { "required": ["root_rationale"] }
    },
    "edge": {
      "type": "object",
      "additionalProperties": false,
      "required": ["from", "to", "reason"],
      "properties": {
        "from": {
          "type": "string",
          "description": "Id of the node that Requires `to` — the node that cannot be tackled before `to` is understood."
        },
        "to": {
          "type": "string",
          "description": "Id of the node that must be understood first."
        },
        "reason": {
          "type": "string",
          "description": "Rationale for the edge, e.g. why B must be understood before A."
        }
      }
    }
  }
}
