{
  "course_name": "Spring Cloud Gateway for a Strangler-Fig Migration to GKE",
  "personas": ["P-DEV", "P-OPS"],
  "nodes": [
    {
      "id": "BSL-DOCKER",
      "type": "Baseline",
      "provenance_tags": ["stated"],
      "key": "docker",
      "description": "Docker containers: images, Dockerfile basics, running and inspecting containers.",
      "knowledge_type": "procedural",
      "held_by": ["P-DEV", "P-OPS"]
    },
    {
      "id": "BSL-GKE-CONTAINERS",
      "type": "Baseline",
      "provenance_tags": ["stated"],
      "key": "gke-containers",
      "description": "Comfort operating containerized infrastructure on GKE (clusters, containers running in them) prior to this course.",
      "knowledge_type": "procedural",
      "held_by": ["P-OPS"]
    },
    {
      "id": "BSL-REST",
      "type": "Baseline",
      "provenance_tags": ["stated"],
      "key": "rest",
      "description": "REST/HTTP fundamentals: verbs, status codes, request/response headers.",
      "knowledge_type": "declarative",
      "held_by": ["P-DEV", "P-OPS"]
    },
    {
      "id": "BSL-SPRING-BOOT",
      "type": "Baseline",
      "provenance_tags": ["stated"],
      "key": "spring-boot",
      "description": "Spring Boot application development fundamentals (dependency injection, application context, common starters).",
      "knowledge_type": "procedural",
      "held_by": ["P-DEV"]
    },
    {
      "id": "DR-DEPLOY-GATEWAY",
      "type": "DesiredResult",
      "provenance_tags": ["stated"],
      "key": "deploy-gateway",
      "description": "Stand up a Spring Cloud Gateway instance and deploy it to a GKE cluster so it is reachable and ready to route traffic.",
      "knowledge_type": "procedural",
      "audience": "all"
    },
    {
      "id": "DR-MINT-TOKEN",
      "type": "DesiredResult",
      "provenance_tags": ["stated", "inferred"],
      "key": "mint-token",
      "description": "At the gateway, mint a custom internal token that emulates the token format the legacy application already expects, and propagate it to downstream services, so legacy/backend code does not need to change immediately.",
      "knowledge_type": "procedural",
      "audience": ["P-DEV"]
    },
    {
      "id": "DR-STRANGLER-ROUTING",
      "type": "DesiredResult",
      "provenance_tags": ["stated"],
      "key": "strangler-routing",
      "description": "Configure path-based route splitting at the gateway so that /legacy/** paths reach the legacy system and new paths reach the migrated microservices.",
      "knowledge_type": "procedural",
      "audience": "all"
    },
    {
      "id": "DR-TRACING",
      "type": "DesiredResult",
      "provenance_tags": ["stated"],
      "key": "tracing",
      "description": "Have the gateway participate in or initiate OpenTelemetry distributed tracing, propagating trace context across gateway, microservices, and the legacy system.",
      "knowledge_type": "procedural",
      "audience": "all"
    },
    {
      "id": "DR-VALIDATE-AUTH",
      "type": "DesiredResult",
      "provenance_tags": ["stated"],
      "key": "validate-auth",
      "description": "Validate incoming JWTs issued by Microsoft Entra ID at the gateway, and apply CORS so legitimate cross-origin browser clients are allowed through.",
      "knowledge_type": "procedural",
      "audience": "all"
    },
    {
      "id": "PRQ-CONTAINERIZE-GATEWAY",
      "type": "Prerequisite",
      "provenance_tags": ["inferred"],
      "key": "containerize-gateway",
      "description": "Building a container image for the Spring Cloud Gateway application (Dockerfile, build process) ready for cluster deployment.",
      "knowledge_type": "procedural",
      "audience": "all",
      "persona_variant": [
        { "persona": "P-DEV", "variant": "Authors/maintains the Dockerfile and application build for the gateway image." },
        { "persona": "P-OPS", "variant": "Operates the image build/publish pipeline and container registry." }
      ]
    },
    {
      "id": "PRQ-CORS-CONCEPT",
      "type": "Prerequisite",
      "provenance_tags": ["stated"],
      "key": "cors-concept",
      "description": "What CORS is and why browsers enforce it: origins, preflight requests, and which response headers a server must return to allow a cross-origin call.",
      "knowledge_type": "declarative",
      "audience": "all"
    },
    {
      "id": "PRQ-CORS-GATEWAY-CONFIG",
      "type": "Prerequisite",
      "provenance_tags": ["stated"],
      "key": "cors-gateway-config",
      "description": "Configuring CORS at the gateway (allowed origins, methods, headers) so browser-based clients can call routed services.",
      "knowledge_type": "procedural",
      "audience": "all",
      "persona_variant": [
        { "persona": "P-DEV", "variant": "Sets the CORS configuration in the gateway's code/config." },
        { "persona": "P-OPS", "variant": "Verifies CORS behavior end-to-end against real client calls." }
      ]
    },
    {
      "id": "PRQ-CUSTOM-GLOBALFILTER-AUTHORING",
      "type": "Prerequisite",
      "provenance_tags": ["stated"],
      "key": "custom-globalfilter-authoring",
      "description": "Writing a custom GlobalFilter/GatewayFilter in Spring Cloud Gateway: filter ordering in the reactive chain, and the WebFlux/reactive gotchas involved in mutating a request or response in-flight.",
      "knowledge_type": "procedural",
      "audience": ["P-DEV"]
    },
    {
      "id": "PRQ-DISTRIBUTED-TRACING-CONCEPTS",
      "type": "Prerequisite",
      "provenance_tags": ["stated"],
      "key": "distributed-tracing-concepts",
      "description": "Distributed tracing concepts: traces, spans, and how trace context propagates across process boundaries via request headers.",
      "knowledge_type": "declarative",
      "audience": "all"
    },
    {
      "id": "PRQ-GATEWAY-JWT-VALIDATION-FILTER",
      "type": "Prerequisite",
      "provenance_tags": ["stated"],
      "key": "gateway-jwt-validation-filter",
      "description": "Configuring the gateway to validate incoming JWTs issued by Microsoft Entra ID before a request is allowed to proceed: signature, issuer, audience, and expiry checks.",
      "knowledge_type": "procedural",
      "audience": "all",
      "persona_variant": [
        { "persona": "P-DEV", "variant": "Implements/configures the resource-server JWT validation on the gateway route." },
        { "persona": "P-OPS", "variant": "Supplies and wires the Entra tenant/JWKS configuration values, and verifies accepted vs rejected requests." }
      ]
    },
    {
      "id": "PRQ-GATEWAY-ROUTE-CONFIG",
      "type": "Prerequisite",
      "provenance_tags": ["inferred", "inherited_inferred"],
      "key": "gateway-route-config",
      "description": "The Spring Cloud Gateway route model: predicates and built-in filters, and how routes are declared/configured (Java DSL or YAML) to direct a request.",
      "knowledge_type": "procedural",
      "audience": "all",
      "persona_variant": [
        { "persona": "P-DEV", "variant": "Authors routes via the Java RouteLocator API or YAML configuration." },
        { "persona": "P-OPS", "variant": "Reads and validates route configuration and the resulting traffic-split behavior, without authoring Java." }
      ]
    },
    {
      "id": "PRQ-GKE-DEPLOY-GATEWAY",
      "type": "Prerequisite",
      "provenance_tags": ["stated", "inherited_inferred"],
      "key": "gke-deploy-gateway",
      "description": "Deploying the containerized gateway onto the GKE cluster: applying manifests, exposing the service, and confirming it is reachable.",
      "knowledge_type": "procedural",
      "audience": "all",
      "persona_variant": [
        { "persona": "P-OPS", "variant": "Leads manifest authoring and the cluster deployment itself." },
        { "persona": "P-DEV", "variant": "Understands the deployment shape well enough to debug and iterate on the running gateway." }
      ]
    },
    {
      "id": "PRQ-JWT-FUNDAMENTALS-DEEP",
      "type": "Prerequisite",
      "provenance_tags": ["inferred"],
      "key": "jwt-fundamentals-deep",
      "description": "Constructing a new JWT programmatically: choosing claims and signing a token, applied specifically to mapping validated Entra ID claims into a differently-shaped token.",
      "knowledge_type": "procedural",
      "audience": ["P-DEV"],
      "depth_staging": {
        "pass": 2,
        "depth": "deep",
        "note": "Revisits JWT structure to construct a new, differently-shaped token from already-validated claims, instead of only validating one."
      }
    },
    {
      "id": "PRQ-JWT-FUNDAMENTALS-SHALLOW",
      "type": "Prerequisite",
      "provenance_tags": ["inferred"],
      "key": "jwt-fundamentals-shallow",
      "description": "What a JWT is: header/claims/signature structure, and what it means to validate a token's signature and standard claims (exp, aud, iss).",
      "knowledge_type": "declarative",
      "audience": "all",
      "depth_staging": {
        "pass": 1,
        "depth": "shallow",
        "note": "Enough structure/claims/signature understanding to validate an incoming token."
      }
    },
    {
      "id": "PRQ-K8S-DEPLOY-CONCEPTS",
      "type": "Prerequisite",
      "provenance_tags": ["inferred", "inherited_inferred"],
      "key": "k8s-deploy-concepts",
      "description": "Kubernetes deployment concepts applied to GKE: Deployments, Services, and Ingress, and how a containerized app is exposed on a cluster.",
      "knowledge_type": "declarative",
      "audience": "all",
      "skippable_by": ["P-OPS"]
    },
    {
      "id": "PRQ-LEGACY-TOKEN-FORMAT",
      "type": "Prerequisite",
      "provenance_tags": ["risk"],
      "key": "legacy-token-format",
      "description": "The exact structure/claims the legacy application currently expects in its authentication token, which the minted gateway token must emulate.",
      "knowledge_type": "declarative",
      "audience": ["P-DEV"],
      "root": true,